{"artifact_status":"test-only","catalog_digest":"sha256:bdf10049121078f8a14e02ad70fb9cdce7f045efd28d96e3c7ab7d69f6c81adc","negative_cases":[{"case_id":"manifest-byte-mutation","expected_exit_code":1,"expected_overall":"invalid-signature"},{"case_id":"dsse-payload-type-mutation","expected_exit_code":2,"expected_overall":"unsupported-algorithm"},{"case_id":"signature-mutation","expected_exit_code":1,"expected_overall":"invalid-signature"},{"case_id":"unknown-key","expected_exit_code":3,"expected_overall":"untrusted-key"},{"case_id":"unknown-algorithm","expected_exit_code":2,"expected_overall":"unsupported-algorithm"},{"case_id":"revoked-release-key","expected_exit_code":3,"expected_overall":"revoked-key"},{"case_id":"expired-key","expected_exit_code":3,"expected_overall":"untrusted-key"},{"case_id":"expired-release","expected_exit_code":4,"expected_overall":"expired-release"},{"case_id":"withdrawn-release","expected_exit_code":4,"expected_overall":"withdrawn-release"},{"case_id":"superseded-release","expected_exit_code":4,"expected_overall":"superseded-release"},{"case_id":"corrected-release","expected_exit_code":4,"expected_overall":"corrected-release"},{"case_id":"missing-artifact","expected_exit_code":1,"expected_overall":"incomplete-bundle"},{"case_id":"extra-artifact","expected_exit_code":1,"expected_overall":"incomplete-bundle"},{"case_id":"report-linkage-mismatch","expected_exit_code":1,"expected_overall":"invalid-report-linkage"},{"case_id":"missing-evidence-reference","expected_exit_code":5,"expected_overall":"claims-not-supported"},{"case_id":"evidence-fail","expected_exit_code":5,"expected_overall":"claims-not-supported"},{"case_id":"evidence-unsupported","expected_exit_code":5,"expected_overall":"not-evaluated"},{"case_id":"evidence-superseded","expected_exit_code":5,"expected_overall":"claims-not-supported"},{"case_id":"evidence-withdrawn","expected_exit_code":5,"expected_overall":"claims-not-supported"},{"case_id":"claim-not-yet-valid","expected_exit_code":5,"expected_overall":"not-evaluated"},{"case_id":"claim-expired-at-verification-time","expected_exit_code":5,"expected_overall":"not-evaluated"},{"case_id":"assumption-invalidated","expected_exit_code":5,"expected_overall":"claims-not-supported"},{"case_id":"assumption-expired","expected_exit_code":5,"expected_overall":"not-evaluated"},{"case_id":"claim-supported-with-assumption","expected_exit_code":1,"expected_overall":"invalid-structure"},{"case_id":"claim-supported-without-required-assumption","expected_exit_code":1,"expected_overall":"invalid-structure"},{"case_id":"malformed-trust-root","expected_exit_code":3,"expected_overall":"untrusted-key"},{"case_id":"invalid-status-signature","expected_exit_code":1,"expected_overall":"invalid-signature"},{"case_id":"embedded-untrusted-key","expected_exit_code":3,"expected_overall":"untrusted-key"},{"case_id":"status-chain-revision-2-without-1","expected_exit_code":1,"expected_overall":"incomplete-bundle"},{"case_id":"status-chain-duplicate-revision","expected_exit_code":1,"expected_overall":"invalid-structure"},{"case_id":"status-chain-revision-gap","expected_exit_code":1,"expected_overall":"invalid-structure"},{"case_id":"status-chain-revision-rollback","expected_exit_code":1,"expected_overall":"invalid-structure"},{"case_id":"status-chain-wrong-previous-digest","expected_exit_code":1,"expected_overall":"invalid-structure"},{"case_id":"status-chain-forked-previous-digest","expected_exit_code":1,"expected_overall":"invalid-structure"},{"case_id":"status-chain-nonincreasing-generated-at","expected_exit_code":1,"expected_overall":"invalid-structure"},{"case_id":"status-chain-wrong-status-key","expected_exit_code":3,"expected_overall":"untrusted-key"},{"case_id":"status-chain-release-key-signature","expected_exit_code":3,"expected_overall":"untrusted-key"},{"case_id":"status-chain-unknown-algorithm","expected_exit_code":2,"expected_overall":"unsupported-algorithm"},{"case_id":"status-chain-wrong-trust-domain","expected_exit_code":1,"expected_overall":"invalid-structure"},{"case_id":"status-chain-invalid-intermediate-signature","expected_exit_code":1,"expected_overall":"invalid-signature"},{"case_id":"status-chain-valid-latest-after-invalid-earlier","expected_exit_code":1,"expected_overall":"invalid-signature"},{"case_id":"status-chain-extra-unlisted-revision","expected_exit_code":1,"expected_overall":"incomplete-bundle"},{"case_id":"status-chain-missing-listed-revision","expected_exit_code":1,"expected_overall":"incomplete-bundle"},{"case_id":"status-chain-changed-status-bytes","expected_exit_code":1,"expected_overall":"incomplete-bundle"},{"case_id":"status-chain-changed-envelope-bytes","expected_exit_code":1,"expected_overall":"incomplete-bundle"},{"case_id":"status-chain-manifest-digest-mismatch","expected_exit_code":1,"expected_overall":"invalid-structure"},{"case_id":"status-chain-tree-digest-mismatch","expected_exit_code":1,"expected_overall":"invalid-structure"},{"case_id":"status-chain-output-set-mismatch","expected_exit_code":1,"expected_overall":"invalid-structure"},{"case_id":"status-chain-latest-revision-mismatch","expected_exit_code":1,"expected_overall":"invalid-structure"},{"case_id":"status-chain-different-release-manifest","expected_exit_code":1,"expected_overall":"invalid-structure"},{"case_id":"status-key-self-authority","expected_exit_code":3,"expected_overall":"untrusted-key"},{"case_id":"status-chain-active-after-revoked","expected_exit_code":1,"expected_overall":"invalid-structure"}],"release_bundle":{"bundle_path":"tests/fixtures/public-release/expected/bundle","file_count":19,"fixture_id":"PUBLIC-RELEASE-IMMUTABLE-V0-1","manifest_digest":"sha256:5bfde7ba6b1901671d4a6a710ca120c4ff9567b2cd705670668072ba6b102205","output_set_digest":"sha256:3356f30f38b434712bbb5777cabc675bca0e4ec6e527278d2a3920d7da27ce7d","release_signature_digest":"sha256:a6bb46433013ce2d3509a1806017359de57700ba1e83a160181284962d8ae084","static_report_model_digest":"sha256:c1802e3d2530638dbda645e64fe662e57b244d20fc02bc6ae643c6087e527828"},"schema_version":"0.1","status_chains":[{"chain_manifest_digest":"sha256:2aa71e37e69b04aaa759a0a44c513a860bd6ebf736baa85090a82f79e8c1abb7","chain_output_set_digest":"sha256:5f7c850b1a3122cda68d429175976ea291e4d701c5ad86b2e27e814a9e4abcff","chain_root":"tests/fixtures/public-release/expected/status-chains/active","expected_exit_code":0,"expected_overall":"verified-fixture-with-limitations","fixture_id":"PUBLIC-RELEASE-STATUS-ACTIVE-V0-1","latest_revision":1,"latest_status_set_digest":"sha256:ad7b523b1d0d48b1579c2090677e4eb9018cb62e5c8c4b7e14e4777a2b83397a","verification_json_digest":"sha256:3e86b474c2bcd86c620f2a7cc00b690db752fea6d2d33cf973d9f8e1dcfce1ef","verification_json_path":"tests/fixtures/public-release/expected/verification-results/active/public-release-verification-result.v0.1.json","verification_markdown_digest":"sha256:691972f92f1b93631ccba4d44944b8aea6fb98fc23744916168975dba079e4dd","verification_markdown_path":"tests/fixtures/public-release/expected/verification-results/active/public-release-verification-result.v0.1.md","verification_result_digest":"sha256:7da61ee9385f44e60bcd0723b3f3afd0ffa00533cca4a4e8caa007272e61f96c","verification_time":"2026-08-04T00:00:00Z"},{"chain_manifest_digest":"sha256:b6087607e3c2d3473127afa7578c94e2e2fd95397c9ad917c5daeb5999564f7b","chain_output_set_digest":"sha256:25c6ca0bb250343ef6d3cc2b6aa119893aca398bbc4093b831e80fa764732ebc","chain_root":"tests/fixtures/public-release/expected/status-chains/revoked","expected_exit_code":3,"expected_overall":"revoked-key","fixture_id":"PUBLIC-RELEASE-STATUS-REVOKED-V0-1","latest_revision":2,"latest_status_set_digest":"sha256:aa976446d369799641fe19cb813d490c9d9471c87b460b22c68850c2dbc56c99","verification_json_digest":"sha256:332d7373ed0b7ca1d17b5aba290aaeaf0b8a0534fc17f728854a3093f7bc29b7","verification_json_path":"tests/fixtures/public-release/expected/verification-results/revoked/public-release-verification-result.v0.1.json","verification_markdown_digest":"sha256:d184bbfb91f7e4453eed02eeaf74573b3009f7320b5edb26ff7f5794963a97bf","verification_markdown_path":"tests/fixtures/public-release/expected/verification-results/revoked/public-release-verification-result.v0.1.md","verification_result_digest":"sha256:bd5a7763b69bc7f7b5711f14de8f58e299d09ae24e4102053dce0504baf2c557","verification_time":"2026-08-04T00:00:00Z"},{"chain_manifest_digest":"sha256:032d19e351e37aa83b37a79a8433baf977fc2ecf2ff7b5806ff290c67438ab68","chain_output_set_digest":"sha256:f0c169f7c9b0a0731f4b8580ae3a2a3e432b8d5343a251da7c7977a939803d2c","chain_root":"tests/fixtures/public-release/expected/status-chains/withdrawn","expected_exit_code":4,"expected_overall":"withdrawn-release","fixture_id":"PUBLIC-RELEASE-STATUS-WITHDRAWN-V0-1","latest_revision":2,"latest_status_set_digest":"sha256:4b91404912c21d3e980cc497d68f5fd84c2e808ee9f2018e66dd1b2fea98980d","verification_json_digest":"sha256:934a9d85cec68cd38c6b1eedb5fbed224d7a036030fee455b7034f82b59c3d19","verification_json_path":"tests/fixtures/public-release/expected/verification-results/withdrawn/public-release-verification-result.v0.1.json","verification_markdown_digest":"sha256:621e2a37d63ea2fb7d7977cca7c41a2df711e6af9b0b59d125b0b192f6e65b2c","verification_markdown_path":"tests/fixtures/public-release/expected/verification-results/withdrawn/public-release-verification-result.v0.1.md","verification_result_digest":"sha256:5b4385e9d4804507b3b0f40f5da764c904d0815b1cec0247f4bd0590f8c01f51","verification_time":"2026-08-04T00:00:00Z"},{"chain_manifest_digest":"sha256:697d744efa4205af192754d15d1c0fd4057180c4c7d01ad25e3c89e4a4dabab0","chain_output_set_digest":"sha256:a991d6798f3260038edd051cb40fd546d3ec55b1dd288d5d99f1c2f0ee88b7d3","chain_root":"tests/fixtures/public-release/expected/status-chains/superseded","expected_exit_code":4,"expected_overall":"superseded-release","fixture_id":"PUBLIC-RELEASE-STATUS-SUPERSEDED-V0-1","latest_revision":2,"latest_status_set_digest":"sha256:e8fc3b352278b4443a51